标题,价格,面积,装修,类型,小区,小区名称,行政区,社区
真。实房源 天府二街  锦城南府样板间套一出租 水电气三通,2800,50平方米,精装修,普通住宅,锦城南府>高新区>大源,锦城南府,高新区,大源
可月付 短租 华府大道地铁口 会龙大道 会龙馨居 拎包入住,1100,45平方米,精装修,普通住宅,会龙小区>高新区>南延线,会龙小区,高新区,南延线
成都东站地铁口急租！无中介！精装套一！随时看房！,1500,60平方米,精装修,普通住宅,兴城嘉苑三期>成华>火车东站,兴城嘉苑三期,成华,火车东站
可短租 可月付 家具齐全 银泰成 天府四街 独立厨卫拎包入住,1299,35平方米,精装修,普通住宅,伏龙西街2号院>双流>白家,伏龙西街2号院,双流,白家
保水逸苑D区 3室8厅3卫 3824元月 南北通透,3824,52平方米,精装修,普通住宅,保水逸苑D区>天府新区>西博城,保水逸苑D区,天府新区,西博城
神仙树地铁口急租！精装套一！房东.直租！随时看房！,1800,60平方米,精装修,普通住宅,和贵时代巢>高新区>神仙树,和贵时代巢,高新区,神仙树
可月付短租华府大道天府五街银泰城民乐骑龙双地铁精装一居,1199,55平方米,精装修,普通住宅,伏龙西街2号院>双流>白家,伏龙西街2号院,双流,白家
7号线槐树店成都东站东门大桥春熙路建设路339牛王庙成渝立交,1700,56平方米,精装修,普通住宅,鲁能城(一期)>成华>万年场,鲁能城(一期),成华,万年场
可月付短租 海昌路 六号线万安镇 麓山大道枫丹铂麓 拎包入住,1000,45平方米,精装修,普通住宅,合能枫丹铂麓一期>天府新区>麓山,合能枫丹铂麓一期,天府新区,麓山
二环高架钢五区 小套一 精装 拧包入住空调 温馨,1400,35平方米,精装修,普通住宅,东桂苑>锦江>海椒市,东桂苑,锦江,海椒市
保水逸苑D区 1室2厅1卫 1250元月 南北通透,1250,65平方米,精装修,普通住宅,保水逸苑D区>天府新区>西博城,保水逸苑D区,天府新区,西博城
可月付短租 警官学院地铁口 二江寺核动力 河池新居拎包入住,1000,45平方米,精装修,普通住宅,河池新居>双流>华府,河池新居,双流,华府
世豪广场 保利星座 都城乐颂居 精装全齐 拎包入住,3000,60平方米,精装修,公寓,都城乐颂居(商住楼)>武侯>火车南站,都城乐颂居(商住楼),武侯,火车南站
世豪广场 保利星座 都城乐颂居 精装全齐 拎包入住,3400,60平方米,精装修,公寓,都城乐颂居(商住楼)>武侯>火车南站,都城乐颂居(商住楼),武侯,火车南站
地铁二号线，精装套一带空调，地铁附近，东方华大广场1300元,1300,44平方米,精装修,普通住宅,东方华大广场>龙泉驿>龙泉驿周边,东方华大广场,龙泉驿,龙泉驿周边
可月付 怡心湖南湖立交地铁口 鑫源新都汇 中海左岸拎包入住,1100,45平方米,精装修,普通住宅,中信城左岸>天府新区>南湖,中信城左岸,天府新区,南湖
可月付 短租 红星美凯龙 万科生活广场 海伦春天 拎包入住,1000,45平方米,精装修,普通住宅,天府鹤林西区>天府新区>华阳,天府鹤林西区,天府新区,华阳
龙泉地铁口附近，精装套一带空调1100元，东方华大广场,1100,42平方米,精装修,普通住宅,东方华大广场>龙泉驿>龙泉驿周边,东方华大广场,龙泉驿,龙泉驿周边
星光小区 1室1厅1卫 800元月 精装修 42平,800,44平方米,精装修,普通住宅,星光小区>龙泉驿>航天片区,星光小区,龙泉驿,航天片区
龙泉地铁口附近，精装套一1100，带空调，东方华大广场有钥匙,1100,42平方米,精装修,普通住宅,东方华大广场>龙泉驿>龙泉驿周边,东方华大广场,龙泉驿,龙泉驿周边
可月付短租 海昌路地铁口 梓州大道海洋公园 恒大名都拎包入住,1200,45平方米,精装修,普通住宅,恒大名都>天府新区>麓山,恒大名都,天府新区,麓山
北湖印象1期 1室1厅1卫  精装修 带家具家电 拎包入住,1000,48平方米,精装修,普通住宅,北湖印象1期>成华>龙潭寺,北湖印象1期,成华,龙潭寺
可月付 短租 6号线地铁口 万安中学 东林春天 独立厨卫,1000,45平方米,精装修,普通住宅,东林春天>天府新区>麓山,东林春天,天府新区,麓山
可月付 麓山大道 海昌路 华府大道 6号线 麓府 全配,1150,45平方米,精装修,普通住宅,合能枫丹铂麓一期>天府新区>麓山,合能枫丹铂麓一期,天府新区,麓山
金融城 交子大道地铁口 中海 仁和春天 润富国际 环球中心,4500,82平方米,精装修,公寓,誉峰遇见>高新区>金融城,誉峰遇见,高新区,金融城
凤凰北街地铁站精装套一带两台空调 随时看房,1800,54平方米,精装修,普通住宅,湟普国际湟座>温江>光华大道,湟普国际湟座,温江,光华大道
可月付 短租 6号线麓山大道地铁口 麓山国际精装全配拎包入住,1100,40平方米,精装修,普通住宅,麓山国际社区>天府新区>麓山,麓山国际社区,天府新区,麓山
可月付 可短租 海昌路地铁口 极地海洋公园 恒大名都精装一室,1049,40平方米,精装修,普通住宅,恒大名都>天府新区>麓山,恒大名都,天府新区,麓山
电梯整租套一！太平园地铁口 设施齐全 拎包入住 近红牌楼,1650,30平方米,精装修,普通住宅,西汽国际唯驿>武侯>红牌楼,西汽国际唯驿,武侯,红牌楼
天府一街益州大道旁 哥谭精装套一可做套二 近环球金融城世纪城,2000,55平方米,精装修,公寓,哥谭>高新区>世纪城,哥谭,高新区,世纪城
天府一街 峰度天下 锦城湖 5号线地铁口 汇锦城 铁像寺水街,3000,60平方米,豪华装修,普通住宅,峰度天下>高新区>大源,峰度天下,高新区,大源
可月付 短租 二江寺地铁口 清河庭院 中海右岸 独立厨卫,1000,45平方米,精装修,普通住宅,清河庭苑>双流>华府,清河庭苑,双流,华府
天府三街大源欢乐颂精装独门独户标间水电气三通 近五号线地铁口,1700,50平方米,精装修,公寓,大源欢乐颂(商住楼)>高新区>大源,大源欢乐颂(商住楼),高新区,大源
一环路北三段鑫源公寓旁城北像树林跃层精装套一出租可月付,2396,66.3平方米,精装修,普通住宅,瑞升城北橡树林(一期)>金牛>李家沱,瑞升城北橡树林(一期),金牛,李家沱
可月付 短租 二江寺地铁 核动力院 格林城 精装全配拎包入住,1100,45平方米,精装修,普通住宅,长顺家园>双流>华府,长顺家园,双流,华府
可月付 中和 6号线 麓山大道 东林春天 和韵小区 麓山国际,1200,45平方米,精装修,普通住宅,东林春天>天府新区>麓山,东林春天,天府新区,麓山
直租无中介！青羊区文殊院骡马市双地铁八宝街 泰丰广场,1770,47平方米,简单装修,普通住宅,时代凯悦>青羊>八宝街,时代凯悦,青羊,八宝街
武侯区无中介省体育馆衣冠庙精装 套一家电齐全来福士广场急租！,1450,46平方米,精装修,普通住宅,洗面桥街9号院>武侯>洗面桥,洗面桥街9号院,武侯,洗面桥
必看好房 1号线天府五街地铁口软件园对面 随时看房拎包入住,1400,29平方米,精装修,公寓,嘉年华青年城smart公寓>高新区>美年广场,嘉年华青年城smart公寓,高新区,美年广场
近地铁高架 莲花逸都大套一 精装修温馨舒适漂亮 设施齐全,2100,55平方米,精装修,普通住宅,瑞升莲花逸都>锦江>海椒市,瑞升莲花逸都,锦江,海椒市
直租无中介！ 红牌楼 武侯大道 东坡路 涴花溪公园 中海大厦,1500,48平方米,精装修,普通住宅,双楠所有阳光>武侯>外双楠,双楠所有阳光,武侯,外双楠
武侯区无中介省体育馆衣冠庙精装 套一家电齐全来福士广场急租！,1450,50平方米,精装修,普通住宅,洗面桥巷8号院>武侯>高升桥,洗面桥巷8号院,武侯,高升桥
可月付 1号线 海昌路 麓山大道 梓州大道 恒大名都 全配,1250,45平方米,精装修,普通住宅,恒大名都>天府新区>麓山,恒大名都,天府新区,麓山
整租地铁口 仁和金沙精装欧式标准套一 采光好 配套齐全有钥匙,2200,50平方米,精装修,普通住宅,仁和金沙>青羊>金沙,仁和金沙,青羊,金沙
仁和金沙一居室 欧式豪装房 配套齐全 实图拍摄拎包入住有钥匙,3200,68平方米,精装修,普通住宅,仁和金沙>青羊>金沙,仁和金沙,青羊,金沙
武侯区无中介省体育馆衣冠庙精装 套一家电齐全来福士广场急租！,1500,50平方米,精装修,普通住宅,洗面桥巷8号院>武侯>高升桥,洗面桥巷8号院,武侯,高升桥
高新区 新川科技园 1号线  6号线地铁口 软件园 温馨套一,2100,68平方米,精装修,公寓,正成南郡>高新区>南延线,正成南郡,高新区,南延线
文殊院地铁旁 融城云熙 珊顿道精装套一出租可月付.,3280,56平方米,精装修,普通住宅,SG珊顿道>青羊>文殊坊,SG珊顿道,青羊,文殊坊
都汇华庭 东门大桥 临地铁 精装套一 拎包入住 随时看房,5500,68平方米,豪华装修,普通住宅,恒大都汇华庭>锦江>春熙路,恒大都汇华庭,锦江,春熙路
新上急租！清江西路地铁口 仁和金沙豪华装修套一 对面西单商场,3000,68平方米,精装修,普通住宅,仁和金沙>青羊>金沙,仁和金沙,青羊,金沙
天府二街 雍湖湾朝南 自住装修!真 实房源 复城国际大源公园,2600,50平方米,精装修,公寓,复地雍湖湾(商住楼)>高新区>大源,复地雍湖湾(商住楼),高新区,大源
天府五街 美年广场 软件园 华府大道 世纪城 精装主次卧月付,1450,50平方米,精装修,普通住宅,嘉年华青年城smart公寓>高新区>美年广场,嘉年华青年城smart公寓,高新区,美年广场
美年广场 嘉年华青年城sm 1室1厅1卫 特价房 无中介,1750,50平方米,精装修,普通住宅,嘉年华青年城smart公寓>高新区>美年广场,嘉年华青年城smart公寓,高新区,美年广场
精装大套一 双空调 天府三街五街 软件园 世纪城 华府大道,2150,60平方米,精装修,普通住宅,嘉年华青年城smart公寓>高新区>美年广场,嘉年华青年城smart公寓,高新区,美年广场
必抢好房 1号线天府五街地铁口软件园对面 随时看房拎包入住,1350,32平方米,精装修,公寓,嘉年华青年城smart公寓>高新区>美年广场,嘉年华青年城smart公寓,高新区,美年广场
福泉中心 1室0厅1卫 1300元月 精装修 42平,1300,42平方米,精装修,公寓,福泉中心>龙泉驿>总站片区,福泉中心,龙泉驿,总站片区
时光绘三色路五冶大厦创世纪凯丽香江琉璃厂7号线,2200,49平方米,精装修,普通住宅,华润东原时光绘>锦江>东光小区,华润东原时光绘,锦江,东光小区
九方银泰交子公园金融城地铁口三色路三瓦窑精装东苑,2100,39平方米,精装修,普通住宅,华润东原时光绘>锦江>东光小区,华润东原时光绘,锦江,东光小区
世豪广场伊藤大源地铁口整租保利星座,1500,40平方米,精装修,公寓,保利星座>高新区>大源,保利星座,高新区,大源
二仙桥民兴南苑整租套一。家具家电齐全随时看房可以月付哈真实图,1400,55平方米,精装修,普通住宅,民兴南苑>成华>二仙桥,民兴南苑,成华,二仙桥
保利星座套一 少女的情怀可爱乖巧装修地铁5号线大源站世豪伊藤,1900,60平方米,精装修,公寓,保利星座>高新区>大源,保利星座,高新区,大源
牛市口地铁口旁国嘉新视界 精装套一出租 装修好 温馨舒适,2300,50平方米,精装修,普通住宅,国嘉新视界>锦江>牛市口,国嘉新视界,锦江,牛市口
（房东直签）蜀汉路地铁口O距离，精装套一，带小花园,1700,70平方米,精装修,普通住宅,蜀汉路交警宿舍>金牛>蜀汉路,蜀汉路交警宿舍,金牛,蜀汉路
合能东城攻略 1室1厅1卫 2000元月 53平 精装修,2000,53平方米,精装修,普通住宅,合能东城攻略>锦江>海椒市,合能东城攻略,锦江,海椒市
龙锦雅苑 套一 家具家电齐全 广场旁 龙潭水乡边 拎包入住,1100,48平方米,简单装修,普通住宅,龙锦雅苑>成华>龙潭寺,龙锦雅苑,成华,龙潭寺
急租！好房子！豪华精装公主床，先到先得，拎包入住，随时看房,3200,68平方米,精装修,普通住宅,仁和金沙>青羊>金沙,仁和金沙,青羊,金沙
天府三街天府软件园创新科技园成都阿里巴巴华府大道环球中心,1600,120平方米,精装修,普通住宅,嘉年华青年城smart公寓>高新区>美年广场,嘉年华青年城smart公寓,高新区,美年广场
可短租~天府长城南尚国际精装标间柏南郡明宇豪雅柏南郡随时看房,1800,42平方米,精装修,普通住宅,南尚国际>高新区>天府长城,南尚国际,高新区,天府长城
高新南尚国际精装标间银泰中心三峡大厦九方易购火车南站川投海关,1800,40平方米,精装修,普通住宅,南尚国际>高新区>天府长城,南尚国际,高新区,天府长城
天府三街天府软件园盛世嘉苑龙祥佳苑中和职中七彩田野喜港城,1400,50平方米,精装修,普通住宅,锦水花乡>锦江>琉璃厂,锦水花乡,锦江,琉璃厂
新上  家乐福楼上 福泉中心 精装套一 家具家电齐全,1300,42平方米,精装修,公寓,福泉中心>龙泉驿>总站片区,福泉中心,龙泉驿,总站片区
急租 锦城南府 猫先生公寓 楼下地铁口交通便利 配套设施齐全,2800,50平方米,精装修,公寓,锦城南府(商住楼)>高新区>大源,锦城南府(商住楼),高新区,大源
鲜花 地铁口 900租标间 地铁口 带空调 家具电齐全拎包住,900,35.5平方米,精装修,普通住宅,鲜花优活居>新都>石油大学,鲜花优活居,新都,石油大学
季度付 家具家电齐全 看房方便,1100,48平方米,简单装修,普通住宅,龙锦雅苑>成华>龙潭寺,龙锦雅苑,成华,龙潭寺
东城映象c区精装套一，随时可以看房子，价格1800元,1800,56平方米,精装修,普通住宅,东城映象C区>成华>杉板桥,东城映象C区,成华,杉板桥
（图片真实）双地铁口，精装大标间，家具家电齐全，临荷花池万达,1850,60平方米,精装修,普通住宅,紫金乐章>金牛>高笋塘,紫金乐章,金牛,高笋塘
5号线，青羊宫，骨科医院，363医院，成都现代城，精装一室,1900,56平方米,精装修,普通住宅,成都现代城>青羊>人民公园,成都现代城,青羊,人民公园
新上 龙平地铁口 无物业费 怡和新城F区  中装套一 带空调,1100,45平方米,简单装修,普通住宅,怡和新城F1区>龙泉驿>总站片区,怡和新城F1区,龙泉驿,总站片区
龙平路地铁D出口60米 怡和新城精装温馨小套一 随时看房,1100,45平方米,精装修,普通住宅,怡和新城F1区>龙泉驿>总站片区,怡和新城F1区,龙泉驿,总站片区
牛市口钢一区 装修套一 配套齐全 带空调地铁高架近 拎包入住,1200,45平方米,简单装修,普通住宅,得胜小区>锦江>牛市口,得胜小区,锦江,牛市口
新桥丽景(B区) 1室1厅1卫 1600元月 精装修,1600,50平方米,精装修,普通住宅,新桥丽景(B区)>金牛>五块石,新桥丽景(B区),金牛,五块石
湟普国际 精装修 地铁口 七中旁 带新风系统 空调,1800,54平方米,精装修,普通住宅,湟普国际湟座>温江>光华大道,湟普国际湟座,温江,光华大道
地铁口旺府豪庭 精装标间 家具电齐全 带空调 拎包入住,1000,48平方米,精装修,普通住宅,旺府豪庭>新都>石油大学,旺府豪庭,新都,石油大学
标准套一 实图 秒出房！,1900,70平方米,精装修,普通住宅,怡馨家园>高新区>南延线,怡馨家园,高新区,南延线
整租|花牌坊附近套一租金800可短租押一付一家电齐全随时看房,800,24平方米,简单装修,公寓,抚林巷8号院>金牛>花牌坊,抚林巷8号院,金牛,花牌坊
800租繁华地段精装套一水电气三通民用配置齐全带空调随时入住,800,27平方米,精装修,公寓,城北优品道(商住楼)>新都>大丰,城北优品道(商住楼),新都,大丰
天府三街地铁口简约风套一 家电齐全拎包入住欢乐颂一品cg,1200,34平方米,精装修,公寓,保利星座>高新区>大源,保利星座,高新区,大源
整租|市二医院附近套一900可短租押一付一家电齐全随时看房,900,23平方米,简单装修,公寓,双栅子街34号院>锦江>春熙路,双栅子街34号院,锦江,春熙路
吉绿苑豪华版套一小区环境赞赞赞生活便利交通方便拎包入住,1800,50平方米,精装修,普通住宅,吉绿苑>武侯>外双楠,吉绿苑,武侯,外双楠
磨子桥小学旁边 金楠龙湖天街 龙爪堰地铁站 武侯大道地铁站,1500,58平方米,精装修,普通住宅,吉春苑>武侯>外双楠,吉春苑,武侯,外双楠
龙湖金楠天街千盛百货近龙爪堰地铁鹭岛国际晋阳新居电梯套一,1900,50平方米,精装修,普通住宅,晋阳新居>武侯>外双楠,晋阳新居,武侯,外双楠
7号线龙爪堰武侯大道地铁口 金楠龙湖天街 双楠伊藤洋华堂,1600,60平方米,精装修,普通住宅,吉春苑>武侯>外双楠,吉春苑,武侯,外双楠
金楠龙湖天街附近  7号线龙爪堰地铁口 鹭岛国际 双楠伊藤洋,1800,66平方米,精装修,普通住宅,晋阳新居>武侯>外双楠,晋阳新居,武侯,外双楠
金楠龙湖天街附近 7号线武侯大道龙爪堰 五大花园 吉春苑,1500,65平方米,精装修,普通住宅,吉春苑>武侯>外双楠,吉春苑,武侯,外双楠
7号线龙爪堰 晋阳新居 双楠伊藤洋华堂 金楠龙湖天街,1800,65平方米,精装修,普通住宅,晋阳新居>武侯>外双楠,晋阳新居,武侯,外双楠
近龙爪堰地铁口500米处新小区环境好旁边就是别墅区视野开阔赞,1900,50平方米,精装修,普通住宅,晋阳新居>武侯>外双楠,晋阳新居,武侯,外双楠
二环路东一段，龙湖三千城旁，（公寓标间，带空调，1100元）,1100,36平方米,精装修,公寓,万基新界>成华>八里小区,万基新界,成华,八里小区
光华大道4号线地铁口  湟普国际湟座   精装套一  非包租,1700,54平方米,精装修,普通住宅,湟普国际湟座>温江>光华大道,湟普国际湟座,温江,光华大道
华府大道天府三街天府软件园创新科技园成都阿里巴巴实图实价,1300,40平方米,精装修,普通住宅,嘉年华青年城smart公寓>高新区>美年广场,嘉年华青年城smart公寓,高新区,美年广场
地铁口套一房冬直租1700天府五街孵化园银泰城软件园,1700,40平方米,精装修,普通住宅,乐活公社>高新区>中和,乐活公社,高新区,中和
凤凰湖国际社区 精装套一 标准一室一厅 家具家电齐全拎包入住,1500,50平方米,精装修,普通住宅,凤凰湖国际社区>青白江>凤凰新城,凤凰湖国际社区,青白江,凤凰新城
整租|骡马市地铁附近套一800可短租押一付一家电齐全随时看房,800,23平方米,简单装修,公寓,东二巷14号院>青羊>天府广场,东二巷14号院,青羊,天府广场
莲桂南路龙舟路 地铁边 全装电梯独立标价 配套齐全 拎包入住,1200,25平方米,简单装修,普通住宅,兰郡驿站>锦江>莲桂路,兰郡驿站,锦江,莲桂路
理工大学 东郊记忆 龙湖樊城 loft 套一 押一付一无中介,1700,25平方米,精装修,公寓,招商中央华城(商住楼)>成华>杉板桥,招商中央华城(商住楼),成华,杉板桥
可短租 可月付精装温馨便宜标间财富中心配置齐全靠近地铁太古里,1600,30平方米,精装修,普通住宅,财富中心>锦江>盐市口,财富中心,锦江,盐市口
新上！软件园旁 中央空调 拎包入住 密码入户 随时看房,2600,60平方米,豪华装修,公寓,嘉年华青年城smart公寓>高新区>美年广场,嘉年华青年城smart公寓,高新区,美年广场
地铁口套一房冬直租1700天府五街天府三街孵化园软件园银泰城,1700,45平方米,精装修,普通住宅,乐活公社>高新区>中和,乐活公社,高新区,中和
大丰地铁口精装整租套一出租，家具家电齐全带空调随时看房,1300,80平方米,精装修,普通住宅,北新国际>新都>大丰,北新国际,新都,大丰
护理学院旁 精装套一 近地铁交通便捷 临近万达广场 地铁站,1200,48平方米,精装修,普通住宅,丽阳晶舍>龙泉驿>商业片区,丽阳晶舍,龙泉驿,商业片区
金融城 誉峰遇见 品质公寓 仅靠悠方 城南一号 银泰中心,2700,50平方米,精装修,公寓,誉峰遇见>高新区>金融城,誉峰遇见,高新区,金融城
文殊院 骡马市 罗马国际 新城市广场精装标间出租可月付.,1760,42平方米,精装修,普通住宅,新城市广场>青羊>新城市广场,新城市广场,青羊,新城市广场
外双楠武侯大道地铁口7号线永辉超市对面电梯套一出租，采光好,2000,68平方米,精装修,普通住宅,金楠国际>武侯>外双楠,金楠国际,武侯,外双楠
迎春桥地铁口  一室一卫一厨出租,1400,50平方米,精装修,普通住宅,正昌幸福岭>双流>东升镇,正昌幸福岭,双流,东升镇
西安路一段   一室一厅一卫  出租,1000,50平方米,简单装修,普通住宅,西门川交>双流>东升镇,西门川交,双流,东升镇
锦城逸景 实图 车位充足 随时入住,1400,50平方米,精装修,普通住宅,锦城逸景A区>锦江>锦江周边,锦城逸景A区,锦江,锦江周边
"整租,押一付一, 无中介，拎被入住! 地铁站附近",2300,46平方米,毛坯,普通住宅,中海翠屏湾>武侯>火车南站,中海翠屏湾,武侯,火车南站
文殊院 锦城华府 新城市广场精装套一出租.可月付,2350,52.2平方米,精装修,普通住宅,新城市广场>青羊>新城市广场,新城市广场,青羊,新城市广场
太平园武侯大道近双楠忆景旁金南国际电梯套一家具齐全,2000,56平方米,精装修,普通住宅,金楠国际>武侯>外双楠,金楠国际,武侯,外双楠
金融城地铁口 誉峰豪装套一 中海国际 润富 悠方 拎包入住,4800,80平方米,豪华装修,公寓,誉峰遇见>高新区>金融城,誉峰遇见,高新区,金融城
广场旁 简单装修 正对中庭 干净卫生 随时看房,1000,50平方米,简单装修,普通住宅,龙锦雅苑>成华>龙潭寺,龙锦雅苑,成华,龙潭寺
建设路 二环 精致套一  电梯小高层  高性价比  随时可看,1800,45平方米,简单装修,普通住宅,合能耀之城>成华>SM广场,合能耀之城,成华,SM广场
（房东直签）蜀汉路地铁口精装套一,2000,60平方米,简单装修,普通住宅,西景花园>金牛>蜀汉路,西景花园,金牛,蜀汉路
实地拍摄布鲁明顿中航国际豪装套一 东方希望 中航城市广场,3200,60平方米,精装修,普通住宅,布鲁明顿广场>高新区>金融城,布鲁明顿广场,高新区,金融城
倪家桥 可月付 短租 家电齐全 干净整洁 小区安全,650,14平方米,简单装修,其他,玉林街9号院>武侯>玉林,玉林街9号院,武侯,玉林
南站 家电齐全 干净整洁 采光好 可月付 小区安全 生活便利,650,14平方米,精装修,其他,长城南苑>武侯>火车南站,长城南苑,武侯,火车南站
可以短租精装温馨套一财富中心真实图片靠近锦江宾馆地铁太古里旁,2300,50平方米,精装修,普通住宅,财富中心>锦江>盐市口,财富中心,锦江,盐市口
万科金色乐府 精装公寓 配置齐全 物业直租 无中介,1700,38平方米,精装修,公寓,万科金色乐府(商住楼)>成华>杉板桥,万科金色乐府(商住楼),成华,杉板桥
缤纷800元一月精装标间 可短租可月付 家具电齐全 干净整洁,900,30平方米,精装修,普通住宅,缤纷新天地>新都>石油大学,缤纷新天地,新都,石油大学
金堂大学城希望未来城标准套一1000一个月全新出租家具家电齐,1000,54平方米,精装修,普通住宅,希望未来城(二期)>金堂>三星,希望未来城(二期),金堂,三星
万象城 温馨小公寓 家电齐全 随时入住,1800,43平方米,精装修,公寓,明信鹭湾(商住楼)>成华>双桥子,明信鹭湾(商住楼),成华,双桥子
新上龙湖上城套一装修巴适拎包入住看房随时干净整洁,2300,50平方米,精装修,普通住宅,龙湖上城>金牛>人民北路,龙湖上城,金牛,人民北路
天府三街地铁口水电气三通套一拎包入住保利星座 欢乐颂一品CG,2300,50平方米,精装修,公寓,锦城南府(商住楼)>高新区>大源,锦城南府(商住楼),高新区,大源
天府五街 银泰城 朗基天香 保利锦江里 美年美岸 精装套一,2600,65平方米,精装修,普通住宅,保利锦江里>天府新区>华阳,保利锦江里,天府新区,华阳
二环蜀汉路口北 蜀汉路地铁东附 独立套一 家具家电拎包入住,1300,35平方米,精装修,普通住宅,营通街99号院>金牛>营门口,营通街99号院,金牛,营门口
2号线 羊犀立交地铁口 精装温馨套一 拎包入住 家乐福 新上,2100,55平方米,精装修,普通住宅,欧韵金沙>青羊>金沙,欧韵金沙,青羊,金沙
世豪广场伊藤大源地铁口整租套一带阳台锦城南府,2500,50平方米,精装修,公寓,锦城南府(商住楼)>高新区>大源,锦城南府(商住楼),高新区,大源
天府五街 美年广场 银泰城 软件园 精装套一拎包入住0中介,1500,40平方米,精装修,普通住宅,嘉年华青年城smart公寓>高新区>美年广场,嘉年华青年城smart公寓,高新区,美年广场
