标题,价格,面积,装修,类型,小区,小区名称,行政区,社区
地铁口 尚林家园电梯房标间家具家电齐全带空调 带单独厨卫急租,1100,38平方米,简单装修,普通住宅,尚林家园>郫都>犀浦,尚林家园,郫都,犀浦
华府大道精装套一 华润时光里5栋精致装修 楼上楼下中和银泰城,1700,45平方米,精装修,普通住宅,华润时光里>双流>华府,华润时光里,双流,华府
合能东城攻略 1室1厅1卫 2000元月 52平 电梯房,2000,52平方米,精装修,普通住宅,合能东城攻略>锦江>海椒市,合能东城攻略,锦江,海椒市
春熙路东大街太古里旁 流星花园 精装套一可以押一付一,2200,48平方米,精装修,普通住宅,流星花园>锦江>东大街,流星花园,锦江,东大街
整租套一   精装 带家具家电 1000,1000,54平方米,精装修,普通住宅,嘉业花园>郫都>德源,嘉业花园,郫都,德源
金融城 精装一居室 拎包入住 近环球中心 世纪城 银泰中心,3000,50平方米,精装修,普通住宅,复地金融岛>高新区>金融城,复地金融岛,高新区,金融城
师大现代花园 可住两人 手慢无,1200,45平方米,精装修,公寓,师大现代花园>龙泉驿>大面,师大现代花园,龙泉驿,大面
出门就是商场 天府欧城精装套一 居家小窝，舒适生活 拎包入住,1300,40平方米,精装修,普通住宅,天府欧城(商住楼)>青白江>文体中心,天府欧城(商住楼),青白江,文体中心
无物业精装套1，家电家具齐全带空调，可随时看房，拎包入住,800,40平方米,精装修,普通住宅,金壁苑A区>龙泉驿>十陵,金壁苑A区,龙泉驿,十陵
新上！清江西路地铁口西单商场旁仁和金沙套一，随时看房拎包入住,2400,46平方米,精装修,普通住宅,仁和金沙>青羊>金沙,仁和金沙,青羊,金沙
0中介！可月付短租！精装套一配置齐全！地铁口旁！科技园附近！,1300,50平方米,精装修,公寓,保利香槟国际>高新西区>百草路,保利香槟国际,高新西区,百草路
整租套一高新区天府三街伊藤大源地铁口世豪广场世豪瑞丽,1800,47平方米,精装修,公寓,世豪广场世豪瑞丽(商住楼)>高新区>大源,世豪广场世豪瑞丽(商住楼),高新区,大源
地铁口景尚景电梯，精装套一，家具家电空调齐全，拎包入住,1200,48平方米,精装修,普通住宅,景尚景(二期)>郫都>郫筒,景尚景(二期),郫都,郫筒
成飞工业园英国小镇知更园 套一 1600元月精装拎包入住,1600,46平方米,精装修,普通住宅,英国小镇知更园>青羊>金沙,英国小镇知更园,青羊,金沙
首 次出租，软件园天府五街 一号线华阳地铁口 标准套一,2000,44平方米,精装修,公寓,金地天府城(商住楼)>高新区>南延线,金地天府城(商住楼),高新区,南延线
时光绘精装标间套一，楼下六号线地铁口，拎包入住,2000,38平方米,精装修,普通住宅,华润东原时光绘>锦江>东光小区,华润东原时光绘,锦江,东光小区
太平园红牌楼 电梯标间 家具家电齐全 0中介包物业实图实价！,1600,45平方米,精装修,普通住宅,西汽国际唯驿>武侯>红牌楼,西汽国际唯驿,武侯,红牌楼
保利爱尚里精装套一公寓 1200季付干净整洁拎包入住欢迎看房,1200,46平方米,精装修,公寓,保利爱尚里>新都>大丰,保利爱尚里,新都,大丰
东城映像 东郊记忆 理工大学  地铁7号线,2080,58平方米,精装修,普通住宅,东城映象C区>成华>杉板桥,东城映象C区,成华,杉板桥
福泉中心 套一 精装 拎包入住 1300月,1300,42平方米,精装修,公寓,福泉中心>龙泉驿>总站片区,福泉中心,龙泉驿,总站片区
拎包入住  南二环 东湖公园旁 随时看房 有地铁,2500,60平方米,精装修,普通住宅,瑞升城北橡树林(一期)>金牛>李家沱,瑞升城北橡树林(一期),金牛,李家沱
金融城管家服务式公寓誉峰精装住家中国华商银泰中心花漾锦江首座,5200,135平方米,豪华装修,公寓,誉峰M5行政公寓>高新区>金融城,誉峰M5行政公寓,高新区,金融城
五医院旁边.精装套一.小区环境优美.地铁口位置.看房方便,1200,50平方米,精装修,普通住宅,上栖美塾>温江>温江城区,上栖美塾,温江,温江城区
万景峰  离富士康近 无中介.费  可月付 随时看房,950,40平方米,精装修,公寓,万景峰(西区商住楼)>郫都>红光,万景峰(西区商住楼),郫都,红光
西南财大，电梯房，精装大标间，可月付可短租,1500,45平方米,精装修,公寓,财经商住楼小区>青羊>府南新区,财经商住楼小区,青羊,府南新区
天泉酒店 中装标准套一 家具家电齐全 经济实惠 拎包入住,900,57平方米,简单装修,普通住宅,凤凰湖天泉住宅小区>青白江>文体中心,凤凰湖天泉住宅小区,青白江,文体中心
东门大桥，九眼桥，春熙路，红星桥339，精装套一带阳台,3500,40平方米,精装修,普通住宅,流星花园>锦江>东大街,流星花园,锦江,东大街
无中介月付 标准套一公寓 四河地铁站旁 华阳车站 天府五街,1800,68平方米,精装修,普通住宅,美高登A座>天府新区>华阳,美高登A座,天府新区,华阳
力合上域中央 1室1厅1卫 1000元月 电梯房 50平,1000,50平方米,简单装修,普通住宅,力合上域中央>青白江>文体中心,力合上域中央,青白江,文体中心
金融城精装一居室 拎包入住 停车免费 近环球中心 招商大魔方,3500,70平方米,豪华装修,普通住宅,复地金融岛>高新区>金融城,复地金融岛,高新区,金融城
天府五街 软件园 精装独立公寓,1500,29平方米,精装修,公寓,JRFANTASIA花漾锦江>高新区>孵化园,JRFANTASIA花漾锦江,高新区,孵化园
月付季付都可以 直租无中介 3号线昭觉寺南路 直达春熙路近,1399,40平方米,精装修,公寓,泛悦城市广场>成华>驷马桥,泛悦城市广场,成华,驷马桥
刚刚拍的照片，2楼，春熙路，九龙，天府广场附近，顺城大街附近,1500,32平方米,精装修,普通住宅,东华门街19号院>青羊>顺城街,东华门街19号院,青羊,顺城街
标准套一 红湖公园城 临地铁 交通便利 离学校 公园,1000,50.6平方米,简单装修,普通住宅,红湖公园城>新都>大丰,红湖公园城,新都,大丰
7号线太平园精装套一家电齐全高朋大道可短租价格便宜交通方便,1800,45平方米,精装修,普通住宅,南桥新居B区>武侯>簇桥,南桥新居B区,武侯,簇桥
华阳精装套一 拎包入住  整租合租单间套一都有 可直接看房,2100,56平方米,精装修,普通住宅,金地天府城>高新区>南延线,金地天府城,高新区,南延线
西河丨精装套一包物业丨家具家电齐全带空调丨看房有钥匙丨,800,50平方米,精装修,普通住宅,金壁苑A区>龙泉驿>十陵,金壁苑A区,龙泉驿,十陵
丽阳晶舍 龙平路D铁中G银行斜对面交通便利旁边不远处大型商场,1200,48平方米,精装修,普通住宅,丽阳晶舍>龙泉驿>商业片区,丽阳晶舍,龙泉驿,商业片区
城南轻奢大一居室首租花漾锦江管家式服务中国华商棕榈泉誉峰环球,8000,136平方米,豪华装修,公寓,JRFANTASIA花漾锦江>高新区>孵化园,JRFANTASIA花漾锦江,高新区,孵化园
花漾锦江新上房源夜景视野超好正看天府三街OCG腾 讯阿里巴巴,9000,135平方米,豪华装修,公寓,JRFANTASIA花漾锦江>高新区>孵化园,JRFANTASIA花漾锦江,高新区,孵化园
万景峰  离富士康近 无中介.费  可月付 随时看房,950,40平方米,精装修,公寓,万景峰(西区)>郫都>红光,万景峰(西区),郫都,红光
临春熙路太古里 IFS 东门大桥 339，现代风精美套一,3300,40平方米,精装修,普通住宅,流星花园>锦江>东大街,流星花园,锦江,东大街
医学院旁香榭澜郡精装套一采光很好视野无遮挡有钥匙看房,1500,50平方米,精装修,普通住宅,和信香榭澜郡>新都>石油大学,和信香榭澜郡,新都,石油大学
环球汇蔚然 1室0厅1卫 3000元月 精装修 可短租,3000,34平方米,精装修,公寓,环球汇蔚然>锦江>牛市口,环球汇蔚然,锦江,牛市口
可月付 大源地铁口 蜀都中心 软件园 保利星座 菁蓉国际广场,1700,53平方米,精装修,公寓,佳年华时代晶座>高新区>大源,佳年华时代晶座,高新区,大源
商贸城旁水电气民用 全景落地窗 价格好商量,750,40平方米,简单装修,公寓,北欧知识城2期(商住楼)>新都>斑竹园,北欧知识城2期(商住楼),新都,斑竹园
天府三街 锦城南府 猫先生楼下地铁口 生活配套齐全 交通便利,2200,50平方米,精装修,公寓,锦城南府(商住楼)>高新区>大源,锦城南府(商住楼),高新区,大源
金融城 精装套一带衣帽间 招商大魔方  环球中心旁 世纪城,4000,70平方米,精装修,普通住宅,复地金融岛>高新区>金融城,复地金融岛,高新区,金融城
高攀路 精装套一 家具家电齐全 干净整洁 拎包入住 地铁口,2500,49平方米,精装修,普通住宅,魏玛国际>武侯>高攀路,魏玛国际,武侯,高攀路
无中介可押一付一。家电家具全齐,1450,35平方米,精装修,普通住宅,美丽朋城>青羊>贝森,美丽朋城,青羊,贝森
地铁2号线800米 人民公园 西府少城 安静宜居 紧邻春熙路,2500,55平方米,精装修,普通住宅,西府少城>青羊>人民公园,西府少城,青羊,人民公园
17号沿线五医院地铁口  上栖美塾拎包入住1200元 2空调,1200,54平方米,精装修,普通住宅,上栖美塾>温江>温江城区,上栖美塾,温江,温江城区
你租的不是房子 是美好生活的开始,1450,35平方米,精装修,公寓,华润时光里>双流>华府,华润时光里,双流,华府
研究院对面 精装套一 家电齐全拎包入住 随时看房子 带空调,1000,45平方米,精装修,普通住宅,天盛商务中心>龙泉驿>总站片区,天盛商务中心,龙泉驿,总站片区
梦魔方广场  2200元月  艺术装修 随时可看,2200,40平方米,精装修,普通住宅,梦魔方广场>成华>火车东站,梦魔方广场,成华,火车东站
月付季付都行 直租无中介 3号线龙桥路 奥特莱斯 双流万达,1499,60平方米,精装修,公寓,金恒德汽配城>双流>东升镇,金恒德汽配城,双流,东升镇
0中介！可月付短租！品牌公寓精装套一！水电气三通临近地铁口！,1100,50平方米,精装修,公寓,百维广场>郫都>红光,百维广场,郫都,红光
无中介！7号线二仙桥！押1付1！东郊记忆！龙湖天街！拎包入住,2000,66平方米,精装修,普通住宅,东城映象C区>成华>杉板桥,东城映象C区,成华,杉板桥
无中介 世纪城 环球中心 金融城 软件园 欧洲中心 天府三街,1650,50平方米,精装修,公寓,嘉年华青年城smart公寓>高新区>美年广场,嘉年华青年城smart公寓,高新区,美年广场
英国风情小镇玫瑰园 1室1厅1卫 1600元月 精装修,1600,47平方米,精装修,普通住宅,英国风情小镇玫瑰园>青羊>金沙,英国风情小镇玫瑰园,青羊,金沙
东站佳年华 精装修住宅标间,1800,33平方米,精装修,普通住宅,佳年华广场二期>成华>火车东站,佳年华广场二期,成华,火车东站
无中介随时看房 拎包入住 天府三街五街南延线嘉年华精装套一,1490,48平方米,精装修,普通住宅,嘉年华青年城smart公寓>高新区>美年广场,嘉年华青年城smart公寓,高新区,美年广场
恒大品质精装大套一带衣帽间晶融汇朗御高端小区租赁房源多,4200,80平方米,豪华装修,普通住宅,恒大都汇华庭>锦江>春熙路,恒大都汇华庭,锦江,春熙路
迎春桥地铁三号线 奥特莱斯 欧尚 万达 海滨城 优品道,1500,53平方米,精装修,普通住宅,正昌幸福岭>双流>东升镇,正昌幸福岭,双流,东升镇
月付季付都行 直租无中介 3号线龙桥路 直达春熙路 双流万达,1299,40平方米,精装修,公寓,金恒德汽配城>双流>东升镇,金恒德汽配城,双流,东升镇
镏金岁月 套一出租 东大路 二号线 地铁站,2200,53平方米,精装修,普通住宅,镏金岁月>锦江>攀成钢,镏金岁月,锦江,攀成钢
刚刚拍的照片，6楼，电梯房，临近红星路二医院，春熙路，太升路,2000,50平方米,精装修,公寓,大发百度城>锦江>红星路,大发百度城,锦江,红星路
金融城 精装一居室带中央空调 看锦江 环球中心旁  银泰中心,3400,56平方米,精装修,普通住宅,复地金融岛>高新区>金融城,复地金融岛,高新区,金融城
幸福家园(都江堰) 1室1厅1卫 999元月 47平,999,47平方米,精装修,普通住宅,幸福家园(都江堰)>都江堰>都江堰城区,幸福家园(都江堰),都江堰,都江堰城区
天府广场骡马市地铁口附近新城市广场旁小区房源独门独户拎包入住,800,46平方米,简单装修,公寓,大有巷12号小区>青羊>天府广场,大有巷12号小区,青羊,天府广场
五医院旁边 上栖美塾 精装套一 带2个空调 房子干净1200,1200,54平方米,精装修,普通住宅,上栖美塾>温江>温江城区,上栖美塾,温江,温江城区
地铁口 石犀公园旁 拎包入住 家具家电齐全 1600押一付三,1600,33平方米,精装修,公寓,龙湖听蓝时光>新都>大丰,龙湖听蓝时光,新都,大丰
大源地铁口 软件园 香年广场 天府三街 银泰城 保利星座,1700,53平方米,精装修,公寓,保利星座>高新区>大源,保利星座,高新区,大源
西南财大对面 精装一居室 1500月 随时看房,1500,44平方米,精装修,普通住宅,财经商住楼小区>青羊>府南新区,财经商住楼小区,青羊,府南新区
一号线 华阳地铁口 海昌路 金地天府城套一 豪华装修拎包入住,2000,47平方米,精装修,公寓,金地天府城(商住楼)>高新区>南延线,金地天府城(商住楼),高新区,南延线
实图精装loft，金融城高新，地铁口，拎包入住,2500,58平方米,精装修,普通住宅,华润东原时光绘>锦江>东光小区,华润东原时光绘,锦江,东光小区
月付季付都行 直租无中介 双流万达广场 海滨城 优品道,1299,50平方米,精装修,公寓,金恒德汽配城>双流>东升镇,金恒德汽配城,双流,东升镇
无中介  可月付  自带商圈,1800,40平方米,精装修,普通住宅,美高登A座>天府新区>华阳,美高登A座,天府新区,华阳
（十四）乃狼山  远看大成都 花郡金装套一 华润大厦伙伴来,2000,44平方米,精装修,普通住宅,花样年花郡>成华>万年场,花样年花郡,成华,万年场
可短租 押一付一 海昌路地铁口 世纪城18号线一站 独立厨卫,1199,40平方米,精装修,普通住宅,香山半岛>天府新区>麓山,香山半岛,天府新区,麓山
乐活公社 1室 1厅1卫,1500,37平方米,精装修,普通住宅,乐活公社>高新区>中和,乐活公社,高新区,中和
1500每月 西南财大 精装大标间家具家电齐全 随时看房,1500,45平方米,精装修,公寓,财经商住楼小区>青羊>府南新区,财经商住楼小区,青羊,府南新区
东大路地铁口蔚然天誉五区精装套一天廊恒大望江华府凯旋门柒公馆,4800,68平方米,豪华装修,普通住宅,COSMO天廊>锦江>攀成钢,COSMO天廊,锦江,攀成钢
金融城新上房源复地金融岛精装住家套一紧邻环球中心楚峰国际中海,3400,72平方米,豪华装修,公寓,复地金融岛>高新区>金融城,复地金融岛,高新区,金融城
紧邻春熙路新南门地铁口近群光广场独门独户家电齐全拎包入住整租,800,43平方米,简单装修,公寓,红星路四段66号院>锦江>春熙路,红星路四段66号院,锦江,春熙路
二环路，双楠伊藤旁，标间，温馨漂亮，拎包入住，全装全配,1499,42平方米,精装修,普通住宅,双楠所有阳光>武侯>外双楠,双楠所有阳光,武侯,外双楠
无门禁 押一付三 地铁口 万达广场楼上 位置巴适 随时看房,2300,63平方米,精装修,普通住宅,万达锦华城(商住楼)>锦江>万达,万达锦华城(商住楼),锦江,万达
0中介！可月付短租！精装套一临配置齐全！近火车北站万达广场！,1200,50平方米,精装修,公寓,龙湖时代天街>高新西区>西源大道,龙湖时代天街,高新西区,西源大道
唯美的您 需要一个唯美的家 万达锦华城精装唯美套一 等您哦,2399,65平方米,精装修,普通住宅,万达锦华城>锦江>万达,万达锦华城,锦江,万达
文星花园，季度付，精装套一，川大口，随时看房,1300,57平方米,简单装修,普通住宅,文星花园>双流>文星,文星花园,双流,文星
和信天骄府精装修标间，带家具家电齐全，可以拎包入住，有钥匙,1000,50平方米,精装修,普通住宅,和信天骄府>新都>新都老城区,和信天骄府,新都,新都老城区
中和套一出租 家具家电齐全 小区近6号线 公交直达天府三街,1600,58平方米,精装修,普通住宅,龙祥佳苑>高新区>中和,龙祥佳苑,高新区,中和
财经楼小区 1室0厅1卫 1500元月 精装修,1500,45平方米,精装修,公寓,财经商住楼小区>青羊>府南新区,财经商住楼小区,青羊,府南新区
北欧一期公寓房水电气三通民用 价格美丽 可以押一付三,800,40平方米,简单装修,公寓,北欧知识城2期(商住楼)>新都>斑竹园,北欧知识城2期(商住楼),新都,斑竹园
可月付 可短租 麓山国际 万安镇 六号线 独立厨卫  拎包住,999,40平方米,精装修,普通住宅,东林春天>天府新区>麓山,东林春天,天府新区,麓山
可月付可短租6号线地铁口万安中学五根松地铁口精装齐全拎包入住,1199,50平方米,精装修,普通住宅,三利麓山城蔚然集>天府新区>麓山,三利麓山城蔚然集,天府新区,麓山
天府三街附近中和精装修套一好房，手慢无需要的赶快,1800,56平方米,精装修,普通住宅,新港国际花园>高新区>中和,新港国际花园,高新区,中和
金融城新上管家服务式公寓首租复地金融到湾流汇 中国华商环球旁,4200,107平方米,精装修,公寓,复地金融岛>高新区>金融城,复地金融岛,高新区,金融城
精装套一 包物业 押一付一 华府大道 新川科技园 五街三街,2200,60平方米,精装修,普通住宅,嘉年华御府>高新区>中和,嘉年华御府,高新区,中和
无中介费 可押一付一 缤纷新天地精装套一 水电民用 可入住!,950,33平方米,精装修,普通住宅,缤纷新天地>新都>石油大学,缤纷新天地,新都,石油大学
世豪广场 大源地铁口 蜀都中心 软件园 银泰城 保利星座伊藤,1800,70平方米,精装修,公寓,保利星座>高新区>大源,保利星座,高新区,大源
东方华大广场 精装套一 家电齐全 环境舒适 电梯房 拎包入住,1200,45平方米,精装修,普通住宅,东方华大广场>龙泉驿>龙泉驿周边,东方华大广场,龙泉驿,龙泉驿周边
花牌坊 宽窄巷子 人民公园 八宝街 夜猫子夜市 永辉超市,1900,55平方米,精装修,普通住宅,新城市广场>青羊>新城市广场,新城市广场,青羊,新城市广场
川大十二中川音九眼桥磨子桥套一1400全装修家俱家电齐空调,1400,43平方米,精装修,普通住宅,近水楼台>武侯>磨子桥,近水楼台,武侯,磨子桥
0中介！可月付短租！精装套一临配置齐全！近火车北站万达广场！,1200,50平方米,精装修,公寓,龙湖时代天街>高新西区>西源大道,龙湖时代天街,高新西区,西源大道
无中介可月付 天府三街五街软件园 翡翠半岛育才竹岛 美年广场,2000,60平方米,精装修,公寓,嘉年华青年城smart公寓>高新区>美年广场,嘉年华青年城smart公寓,高新区,美年广场
电梯套一！牛市口地铁口 东大路 牛王庙 锦江万达 塔子山公园,2300,60.2平方米,精装修,普通住宅,澳龙名城维格>锦江>攀成钢,澳龙名城维格,锦江,攀成钢
花漾锦江新上房大一居房源星 级管家服务式公寓银泰誉峰W酒店旁,8500,135平方米,精装修,公寓,JRFANTASIA花漾锦江>高新区>孵化园,JRFANTASIA花漾锦江,高新区,孵化园
可月付可短租华府大道地铁口天台路香璟台中德英伦联邦精装齐全,1299,40平方米,精装修,普通住宅,香璟台西苑>高新区>中和,香璟台西苑,高新区,中和
直租 无中介 押一付一 精装套一 2号线牛市口 春熙路,2000,62平方米,精装修,普通住宅,国嘉新视界>锦江>牛市口,国嘉新视界,锦江,牛市口
（川化一村）四楼套一，靠近工业园区，天美广场,500,50平方米,简单装修,普通住宅,川化住宅区>青白江>凤凰新城,川化住宅区,青白江,凤凰新城
无中介可月付 世纪城 欧洲中心 天府软件园 远大购物中心五街,1550,50平方米,精装修,普通住宅,嘉年华青年城smart公寓>高新区>美年广场,嘉年华青年城smart公寓,高新区,美年广场
可月付 可短租 麓山国际社区 万安镇  六号线 精装套一,1199,50平方米,精装修,普通住宅,东林春天>天府新区>麓山,东林春天,天府新区,麓山
地铁口 标准套一 安静不临街 干净整洁 拎包入住 生活便利,1800,42平方米,简单装修,普通住宅,高攀路18号院>武侯>高攀路,高攀路18号院,武侯,高攀路
红湖公园城 套一带空调 1000元月 配套齐全 精装修,1000,50.6平方米,精装修,普通住宅,红湖公园城>新都>大丰,红湖公园城,新都,大丰
软件园旁精装套一房东直签,1800,42平方米,精装修,公寓,乐活公社>高新区>中和,乐活公社,高新区,中和
Q城摩登派 1室1厅1卫 2000元月 配套齐全 电梯房,2000,45.6平方米,精装修,普通住宅,Q城摩登派>锦江>龙舟路,Q城摩登派,锦江,龙舟路
天府大道 天府三街 天府五街软件园 翡翠半岛 拎包入住,1450,31平方米,精装修,公寓,嘉年华青年城smart公寓>高新区>美年广场,嘉年华青年城smart公寓,高新区,美年广场
天府五街软件园 精装loft套二 近地铁 家具齐全 拎包入住,2100,72平方米,精装修,公寓,华润时光里>双流>华府,华润时光里,双流,华府
英祥北城映像 1室1厅1卫 1300元月loft 电梯房,1300,47平方米,精装修,公寓,英祥北城映像>青白江>文体中心,英祥北城映像,青白江,文体中心
保利锦江里 1室1厅1卫 2500元月 南北通透 精装修,2500,51平方米,精装修,普通住宅,保利锦江里>天府新区>华阳,保利锦江里,天府新区,华阳
紧邻春熙路市二医院地铁口小区房源独门独户家电齐全拎包入住整租,1200,64平方米,简单装修,公寓,双栅子街51号院>锦江>红星路,双栅子街51号院,锦江,红星路
家电齐全 双空调 短租三个月,1200,55平方米,精装修,普通住宅,秀林苑西区>成华>龙潭寺,秀林苑西区,成华,龙潭寺
伊藤旁，洪河口。绿地星朗，全新家电家具，首租！,1800,40平方米,精装修,公寓,绿地中心468星朗>锦江>三圣乡,绿地中心468星朗,锦江,三圣乡
太升南路骡马市地铁口押一付一随时看房家具家电齐全拎包入住整租,800,42平方米,简单装修,公寓,顺城大街212号院>青羊>顺城街,顺城大街212号院,青羊,顺城街
可月付可短租海昌路地铁口新殿洛森堡 滨江和城精装套一拎包入住,1299,50平方米,精装修,普通住宅,洛森堡新殿>天府新区>麓山,洛森堡新殿,天府新区,麓山
月付季付都行 直租无中介 3号线龙桥路 直达春熙路省体育馆,1099,31平方米,精装修,公寓,金恒德汽配城>双流>东升镇,金恒德汽配城,双流,东升镇
无中介押一付一近地铁昭觉寺南路春熙路驷马桥升仙湖动物园红星桥,1650,40平方米,豪华装修,普通住宅,鑫禾北城鑫街>成华>驷马桥,鑫禾北城鑫街,成华,驷马桥
华大广场楼上 巴适精装套一 家电齐全拎包入住 带空调 随时看,1200,45平方米,精装修,普通住宅,东方华大广场>龙泉驿>龙泉驿周边,东方华大广场,龙泉驿,龙泉驿周边
临近骡马市文殊院地铁口近天府广场小区房源押一付一家电齐全整租,800,46平方米,简单装修,公寓,东二巷20号院>青羊>顺城街,东二巷20号院,青羊,顺城街
可月付 可短租 一号线华府大道  天府三街 新川创新科技园,1199,35平方米,精装修,普通住宅,会龙馨居>高新区>中和,会龙馨居,高新区,中和
整租新上房 政务大厅旁 精装套一 家具家电齐全 交通便利,1300,42平方米,精装修,普通住宅,壹中心>龙泉驿>总站片区,壹中心,龙泉驿,总站片区
整租高新区天府三街保利星座精装套一世豪伊藤地铁近软件园,1300,30平方米,精装修,公寓,保利星座>高新区>大源,保利星座,高新区,大源
免中介 押一付一 佳年华广场 可短租 双地铁 火车东站,1950,55平方米,精装修,普通住宅,佳年华广场二期>成华>火车东站,佳年华广场二期,成华,火车东站
0中介！可月付！精装套一犀浦夜市口，临近地铁！配置齐全！！！,1300,50平方米,精装修,公寓,龙城高新天地>郫都>犀浦,龙城高新天地,郫都,犀浦
文殊院 八宝街新城市广场精装大套一,2300,51平方米,精装修,普通住宅,新城市广场>青羊>新城市广场,新城市广场,青羊,新城市广场
紧邻牛市口地铁口家具家电齐全随时看房交通便利拎包入住独门独户,900,22平方米,简单装修,公寓,牛市口路56号院>锦江>九眼桥,牛市口路56号院,锦江,九眼桥
丽阳晶舍 1室1厅1卫 1000元月 精装修 南北通透,1000,48平方米,精装修,普通住宅,丽阳晶舍>龙泉驿>商业片区,丽阳晶舍,龙泉驿,商业片区
